{
    "$schema": "_schema.json",

    "name": "岐阜県立岐阜総合学園高等学校",
    "source": "https://school.gifu-net.ed.jp/wordpress/sogo-hs/%E3%80%8Cmanaba%E3%80%8D%E3%83%AD%E3%82%B0%E3%82%A4%E3%83%B3%E3%83%9A%E3%83%BC%E3%82%B8/",
    "tags": [
        "#春から岐阜総合"
    ],

    "manaba-url": "https://gifu.manaba.jp/ct/",
    "bad-status": []
}
