{
    "name": "大阪樟蔭女子大学",
    "source": "https://manaba.osaka-shoin.ac.jp/ct/course_407236",
    "tags": [
        "#春からOSWU",
        "#春から樟蔭",
        "#春から大阪樟蔭",
        "#春から大阪樟蔭女子",
        "#春から大阪樟蔭女子大学"
    ],
    
    "manaba-url": "https://manaba.osaka-shoin.ac.jp/ct/",
    "bad-status": []
}